number,value,datetime_start,datetime_complete,duration,params_C,params_gamma,params_kernel,state
0,0.3732306634791426,2026-03-11 18:17:28.041023,2026-03-11 18:17:29.079647,0 days 00:00:01.038624,0.31489116479568624,0.024810409748678097,rbf,COMPLETE
1,0.3403435973132475,2026-03-11 18:17:29.080150,2026-03-11 18:17:30.376472,0 days 00:00:01.296322,0.04207988669606638,0.29154431891537513,rbf,COMPLETE
2,0.32203332452546074,2026-03-11 18:17:30.376472,2026-03-11 18:17:31.762319,0 days 00:00:01.385847,2.5378155082656657,0.7579479953348001,rbf,COMPLETE
3,0.31511821732617856,2026-03-11 18:17:31.762319,2026-03-11 18:17:33.104451,0 days 00:00:01.342132,21.368329072358772,0.0005415244119402539,rbf,COMPLETE
4,0.32152538803393627,2026-03-11 18:17:33.104451,2026-03-11 18:17:34.022804,0 days 00:00:00.918353,0.1648044642797898,0.0014618962793704966,rbf,COMPLETE
5,0.27597485490585927,2026-03-11 18:17:34.023806,2026-03-11 18:17:42.458666,0 days 00:00:08.434860,2.801635158716261,,linear,COMPLETE
6,0.30564490954186285,2026-03-11 18:17:42.458666,2026-03-11 18:17:43.990189,0 days 00:00:01.531523,0.2920433847181412,,linear,COMPLETE
7,0.29565707999145296,2026-03-11 18:17:43.991191,2026-03-11 18:17:44.818628,0 days 00:00:00.827437,0.0629064429458615,,linear,COMPLETE
8,0.36714274995409457,2026-03-11 18:17:44.819629,2026-03-11 18:17:45.872519,0 days 00:00:01.052890,0.015339162591163621,0.00018205657658407274,rbf,COMPLETE
9,0.3705120418675087,2026-03-11 18:17:45.872519,2026-03-11 18:17:47.160307,0 days 00:00:01.287788,62.451395747430766,0.001653693718282443,rbf,COMPLETE
10,0.27684202445164385,2026-03-11 18:17:47.160307,2026-03-11 18:17:50.345674,0 days 00:00:03.185367,0.8560089924423594,,linear,COMPLETE
11,0.3713846130100499,2026-03-11 18:17:50.345674,2026-03-11 18:17:52.211173,0 days 00:00:01.865499,75.53503645583187,0.01830005364066773,rbf,COMPLETE
12,0.37750870936797404,2026-03-11 18:17:52.211173,2026-03-11 18:17:53.419892,0 days 00:00:01.208719,9.10183061662951,0.0313569713135636,rbf,COMPLETE
13,0.3777735129571854,2026-03-11 18:17:53.420895,2026-03-11 18:17:54.935658,0 days 00:00:01.514763,9.520145760425361,0.040288534565571445,rbf,COMPLETE
14,0.3544093408512074,2026-03-11 18:17:54.935658,2026-03-11 18:17:56.456466,0 days 00:00:01.520808,9.762852978975706,0.10323156410961296,rbf,COMPLETE
15,0.3655577473870852,2026-03-11 18:17:56.456466,2026-03-11 18:17:57.935520,0 days 00:00:01.479054,9.506239463451678,0.057485947430604534,rbf,COMPLETE
16,0.37180939605619445,2026-03-11 18:17:57.935520,2026-03-11 18:17:59.017696,0 days 00:00:01.082176,3.8365771791852548,0.007150171273944854,rbf,COMPLETE
17,0.384432083691999,2026-03-11 18:17:59.018696,2026-03-11 18:18:00.171162,0 days 00:00:01.152466,19.257921577818596,0.005306415290220821,rbf,COMPLETE
18,0.2821505310041054,2026-03-11 18:18:00.171162,2026-03-11 18:20:14.823430,0 days 00:02:14.652268,30.710236402481502,,linear,COMPLETE
19,0.3344122582881194,2026-03-11 18:20:14.823430,2026-03-11 18:20:16.017347,0 days 00:00:01.193917,1.0144680291126795,0.004519132066666018,rbf,COMPLETE
20,0.34865193856699095,2026-03-11 18:20:16.018347,2026-03-11 18:20:17.478471,0 days 00:00:01.460124,24.433433117837595,0.15374929037456084,rbf,COMPLETE
21,0.3754657472932196,2026-03-11 18:20:17.478471,2026-03-11 18:20:18.891164,0 days 00:00:01.412693,8.875950901766004,0.03506362315129532,rbf,COMPLETE
22,0.3856984779463558,2026-03-11 18:20:18.891164,2026-03-11 18:20:19.997655,0 days 00:00:01.106491,5.661324486824432,0.012353254875942028,rbf,COMPLETE
23,0.37124427866142745,2026-03-11 18:20:19.997655,2026-03-11 18:20:21.121509,0 days 00:00:01.123854,4.531648784307023,0.006234348342417566,rbf,COMPLETE
24,0.3403519958236819,2026-03-11 18:20:21.122509,2026-03-11 18:20:22.262674,0 days 00:00:01.140165,1.7486192319638494,0.0023077497651039568,rbf,COMPLETE
25,0.3760184423741608,2026-03-11 18:20:22.262674,2026-03-11 18:20:23.799878,0 days 00:00:01.537204,39.9110443212407,0.012962061180137124,rbf,COMPLETE
26,0.2839375763525755,2026-03-11 18:20:23.799878,2026-03-11 18:21:06.945667,0 days 00:00:43.145789,14.012366471299655,,linear,COMPLETE
27,0.3439052332696325,2026-03-11 18:21:06.946667,2026-03-11 18:21:08.252468,0 days 00:00:01.305801,5.338578345914685,0.00323666069535588,rbf,COMPLETE
28,0.36868198074292746,2026-03-11 18:21:08.252468,2026-03-11 18:21:09.400807,0 days 00:00:01.148339,0.9344028792207704,0.009708585715163151,rbf,COMPLETE
29,0.3558416917221595,2026-03-11 18:21:09.400807,2026-03-11 18:21:10.911097,0 days 00:00:01.510290,17.691433513246565,0.07086030361429553,rbf,COMPLETE
30,0.3674412683141789,2026-03-11 18:21:10.911097,2026-03-11 18:21:12.355654,0 days 00:00:01.444557,78.02893403373851,0.0007087963161648795,rbf,COMPLETE
31,0.37784849097998524,2026-03-11 18:21:12.355654,2026-03-11 18:21:13.826556,0 days 00:00:01.470902,6.11066181439923,0.0369087224270883,rbf,COMPLETE
32,0.3858792789526385,2026-03-11 18:21:13.827556,2026-03-11 18:21:14.984488,0 days 00:00:01.156932,5.782325098276669,0.013887722969354342,rbf,COMPLETE
33,0.3725218598842329,2026-03-11 18:21:14.984488,2026-03-11 18:21:16.067760,0 days 00:00:01.083272,1.4711686607782046,0.015469851508290158,rbf,COMPLETE
34,0.3763611228550624,2026-03-11 18:21:16.067760,2026-03-11 18:21:17.196423,0 days 00:00:01.128663,5.585734766578606,0.0066066442204424465,rbf,COMPLETE
35,0.3708099547512906,2026-03-11 18:21:17.196423,2026-03-11 18:21:18.252727,0 days 00:00:01.056304,0.4908334533577295,0.013445331752387287,rbf,COMPLETE
36,0.3765382342506867,2026-03-11 18:21:18.252727,2026-03-11 18:21:19.370841,0 days 00:00:01.118114,2.2143855148418052,0.02323114866206531,rbf,COMPLETE
37,0.38887998809328744,2026-03-11 18:21:19.372344,2026-03-11 18:21:20.637450,0 days 00:00:01.265106,40.789875305316556,0.003920784753353941,rbf,COMPLETE
38,0.28855697868706354,2026-03-11 18:21:20.637450,2026-03-11 18:27:37.981204,0 days 00:06:17.343754,44.779700313766796,,linear,COMPLETE
39,0.314266931523024,2026-03-11 18:27:37.981204,2026-03-11 18:27:39.266136,0 days 00:00:01.284932,17.133141420837447,0.000704886540261053,rbf,COMPLETE
40,0.385653765153356,2026-03-11 18:27:39.266136,2026-03-11 18:27:40.856774,0 days 00:00:01.590638,97.45337840664838,0.0030324276934875645,rbf,COMPLETE
41,0.38728508896871555,2026-03-11 18:27:40.856774,2026-03-11 18:27:42.120964,0 days 00:00:01.264190,47.04319511958245,0.0035197881883326987,rbf,COMPLETE
42,0.37558186013237116,2026-03-11 18:27:42.120964,2026-03-11 18:27:43.669659,0 days 00:00:01.548695,96.58318826868287,0.004136899942732352,rbf,COMPLETE
43,0.36847743208369305,2026-03-11 18:27:43.670162,2026-03-11 18:27:44.948818,0 days 00:00:01.278656,46.384509035228156,0.0012606826903284194,rbf,COMPLETE
44,0.27330645706518353,2026-03-11 18:27:44.949819,2026-03-11 18:29:55.628159,0 days 00:02:10.678340,30.751459283791977,,linear,COMPLETE
45,0.33831252280492385,2026-03-11 18:29:55.628159,2026-03-11 18:29:56.616477,0 days 00:00:00.988318,0.13345312075839905,0.0025489350461142916,rbf,COMPLETE
46,0.3143129633046685,2026-03-11 18:29:56.617480,2026-03-11 18:29:58.195616,0 days 00:00:01.578136,65.96899429444385,0.00030893355752769453,rbf,COMPLETE
47,0.3687261880480153,2026-03-11 18:29:58.195616,2026-03-11 18:29:59.501274,0 days 00:00:01.305658,50.74358361832468,0.0011184984211942476,rbf,COMPLETE
48,0.3484356243293785,2026-03-11 18:29:59.501274,2026-03-11 18:30:00.814608,0 days 00:00:01.313334,30.62411544334241,0.9074966324558174,rbf,COMPLETE
49,0.29079432148989526,2026-03-11 18:30:00.814608,2026-03-11 18:30:01.490040,0 days 00:00:00.675432,0.016663069336368425,,linear,COMPLETE
50,0.36770310224979036,2026-03-11 18:30:01.491043,2026-03-11 18:30:02.659350,0 days 00:00:01.168307,13.188823501880814,0.0019433174506300547,rbf,COMPLETE
51,0.38018219651348717,2026-03-11 18:30:02.659350,2026-03-11 18:30:03.934394,0 days 00:00:01.275044,22.08842080925022,0.004459670260509183,rbf,COMPLETE
52,0.37854786043520516,2026-03-11 18:30:03.934394,2026-03-11 18:30:05.659596,0 days 00:00:01.725202,99.35138101942596,0.00931413957823288,rbf,COMPLETE
53,0.38697667579158795,2026-03-11 18:30:05.660099,2026-03-11 18:30:06.979647,0 days 00:00:01.319548,62.2424696288426,0.003181115468435565,rbf,COMPLETE
54,0.389220975801703,2026-03-11 18:30:06.979647,2026-03-11 18:30:08.299721,0 days 00:00:01.320074,69.92524768815026,0.0031263003585627527,rbf,COMPLETE
55,0.3686966549468197,2026-03-11 18:30:08.300224,2026-03-11 18:30:09.997739,0 days 00:00:01.697515,58.75104865345862,0.02210077143642483,rbf,COMPLETE
56,0.32886113183216814,2026-03-11 18:30:09.998741,2026-03-11 18:30:11.311114,0 days 00:00:01.312373,34.54213884831229,0.47688453808052117,rbf,COMPLETE
57,0.37958707984542966,2026-03-11 18:30:11.312617,2026-03-11 18:30:12.548480,0 days 00:00:01.235863,23.543542839185537,0.008763688657250164,rbf,COMPLETE
58,0.33854081264756686,2026-03-11 18:30:12.548480,2026-03-11 18:30:13.702792,0 days 00:00:01.154312,2.9081549064476455,0.0014767689185338126,rbf,COMPLETE
59,0.3006836768908174,2026-03-11 18:30:13.702792,2026-03-11 18:30:15.885521,0 days 00:00:02.182729,0.40700548104481327,,linear,COMPLETE
